<?xml version="1.0"?>
<xs:schema xmlns:xs="http://www.w3.org/2001/XMLSchema" elementFormDefault="qualified">
    <xs:element name="vehiculos">
        <xs:complexType>
          <xs:sequence>

            <xs:element name="vehiculo" maxOccurs="unbounded">
              <xs:complexType>
                <xs:sequence>
                  <xs:element name="nombre" type="xs:string"/>
                  <xs:element name="modelo" type="xs:string"/>

                  <xs:element name="fabricacion">
                    <xs:complexType>
                      <xs:sequence>
                        <xs:element name="inicio">
                          <xs:complexType>
                            <xs:sequence>
                              <xs:element name="dia" type="xs:int"/>
                              <xs:element name="mes" type="xs:string"/>
                              <xs:element name="anyo" type="xs:int"/>
                            </xs:sequence>
                          </xs:complexType>
                        </xs:element>
                        <xs:element name="fin">
                          <xs:complexType>
                            <xs:sequence>
                              <xs:element name="dia" type="xs:int"/>
                              <xs:element name="mes" type="xs:string"/>
                              <xs:element name="anyo" type="xs:int"/>
                            </xs:sequence>
                          </xs:complexType>
                        </xs:element>
                      </xs:sequence>
                    </xs:complexType>
                  </xs:element>
                  <xs:element name="modificaciones" minOccurs="0">
                    <xs:complexType>
                      <xs:sequence>
                        <xs:element name="modificacion" maxOccurs="unbounded">
                          <xs:complexType>
                            <xs:simpleContent>
                              <xs:extension base="xs:string">
                                <xs:attribute name="pagada" type="xs:boolean" default="false"/>
                              </xs:extension>
                            </xs:simpleContent>
                          </xs:complexType>
                        </xs:element>
                      </xs:sequence>
                    </xs:complexType>
                  </xs:element>
                </xs:sequence>
                <xs:attribute name="num-serie" type="xs:string"></xs:attribute>
              </xs:complexType>
            </xs:element>
          </xs:sequence>
        </xs:complexType>
    </xs:element>
</xs:schema>

